82.14			BERQUIN, Arnaud				L’ami des enfans, par M. Berquin		Paris			Pissot et Théophile Barrois [ensuite: Au bureau de l’Ami des enfans ]			1782	1782 - 1783				24t. in-18					A BM BNt Ersch Gumuchian		Cet ouvrage a été distribué aux abonnés au rythme d’un volume (de 144p. en moyenne) par mois pendant deux ans. Les collections complètes des premières éditions sont rares. Certains numéros ont été réimprimés suivant la demande et portent la mention ‘deuxième édition’ ou ‘troisième édition’ (v. Gumuchian, cf. BN R 22657-58). Pour les autres ouvrages de Berquin, qui font la suite de cette publication, v. 84.11, 86.30, 90.27,91.12.														Petits récits, dialogues et pièces de théâtre pour enfants							
82.17			CHODERLOS DE LACLOS, Pierre-Ambroise-François				Les liaisons dangereuses ou lettres recueillies dans une société & publiées pour l’instruction de quelques autres, par M. C.....de L ...		Amsterdam & Paris			Durand neveu			1782	1782				4 part, in-12			248, 242, 231, 257p.		A BNt AL 1782 III 145-163; ConL avril 1782; JL xü 1782; JP 28.ÜL82 B Delcro Gay Q		Sur les éditions de ce roman, v. les travaux suivants,qui nous ont fourni la plupart des détails résumés ci-dessous: Henri Ducup de Saint-Paul, Essai bibliographique sur les deux véritables éditions originales des ‘Liaisons dangereuses’ de Choderlos de Laclos et sur d’autres éditions françaises intéressantes de ce roman, Paris, Giraud-Badin, 1928, 70p.; Gérard Willemetz, ‘La véritable deuxième édition originale des Liaisons dangereuses’, Bulletin du bibliophile, 1957, no.2, pp. 45-52; Max Brun, ‘Contribution bibliographique à l’étude des éditions des Liaisons dangereuses portant le millésime 1782’, Bulletin du bibliophile, 1958, no. 2-4, pp. 49-173; et un deuxième article par Max Brun, ‘Bibliographie des éditions des Liaisons dangereuses portant le millésime 1782’, Le Livre et l’estampe, no. 33, 1963, pp. 5-64. Dans cette dernière étude, M. Brun donne une description détaillée des seize éditions de 1782, et de celles de 1787, 1792 et 1796.					Lettres			Paris, province			Cécile Volanges, la marquise de Merteuil, le vicomte de Valmont, la présidente Tourvel			intrigues libertines, vengeances			analyse psychologique				
82.20			GENLIS, Stéphanie-Félicité Ducrest de Saint-Aubin, marquise de Sillery, comtesse de				Adèle et Théodore ou lettres sur l’éducation, contenant tous les principes relatifs aux trois différens plans d’éducation des princes, des jeunes personnes, & des hommes		Paris			M. Lambert et F.J. Baudouin			1782	1782				3t. in-8			460, 430, 464p.		At BM BNt AL 1782 V 217-288; CorrL janv. 1782; JL iv 1782; JP 21, 22.iii.82 Delcro Q		Les éditions données comme collections des Œuvres de madame de Genlis semblent être faites presque toujours de volumes publiés à part et avec des dates disparates. Il est vrai que Q donne une édition des Œuvres en 1791 (17t. in-8 et in-12), mais nous n’en avons pas trouvé d’exemplaires. A partir de 1801, Maradan à Paris paraît avoir tenu à jour une collection des differents ouvrages de madame de Genlis, mais chaque titre se vendait séparément et nous les indiquons ainsi dans nos listes.					Lettres			Languedoc			le baron et la baronne d’Almane; Adèle, Théodore, madame d’Ostalis			deux époux se retirent en province pour élever leurs enfants			but didactique (roman d’éducation), sensibilité, vertu				
82.27			LESUIRE, Robert-Martin				L’aventurier françois ou mémoires de Grégoire Merveil		Londres & Paris			Quillau, veuve Duchesne, et les libraires qui vendent les nouveautés			1782	1782				2t. in-12			ii+260, 348p.		A BNt AL 1782 IV 3-28; JL xviü 1782; JP 2O.iv, 25.vii.82 B Delcro Dufrenoy Gay Gove Q		Une première Suite a été publiée en 1783 (83.32); une Seconde suite en 1785-1786 (85.34); et une Dernière suite en 1788(88.78).					Ire personne			Paris, Italie, Brésil, Terres australes			Julie, Ninelte, Mlle de Mirville, Almanzine			aventures romanesques, voyages en France et dans des pays exotiques, description d’un pays imaginaire			thèmes philosophiques, quelques épisodes aux tendances réalistes				
83.15			ARNAUD, François-Thomas-Marie de Baculard d’				Les époux malheureux ou histoire de monsieur et madame de nouvelle édition, corrigée, augmentée de deux nouvelles parties, qui sont la conclusion de l’histoire, enrichie de belles estampes, &c., par M. d’Arnaud		Paris			veuve Ballard et Laporte			1783	1783				2t. in-8			xii + 288, 238(pour 256)p.		BNt AL 1783 IV 239; JL vi 1783; JP 4.Ü, 15.iii.83 B Gay Inklaar Q		C’est une nouvelle version d’un ouvrage publié en 1746 (v.58.R5). Selon l’avertissement, ‘les quatre premières Parties sont pleines de changements heureux, ainsi que d’augmentations considérables: les deux dernières qui mettent le complément au tableau, & qui paraissent ici pour la première fois, feront peut-être encore plus de plaisir que les parties précédentes’. 11. 83-238, Suite (parties V et VI):					1re personne			province			monsieur de Sainmoran, Agathe, Gérard			pour échapper à la poursuite, les membres de la famille La Bédoyère se déguisent en paysans...			sensibilité larmoyante, malheurs				
83.26			FLORIAN, Jean-Pierre				Claris de Galatée, roman pastoral, imité de Cervantes par M. de Florian, capitaine de dragons et gentilhomme de S.A.S. Mgr le duc de Penthievre		Paris			Didot l’aîné			1783	1783				in-18			198p.		At BM AL 1783 VIII 73-102; CorrL nov. 1783; JL xlix 1783, xvii 1784; JP 20.xi.83, 5.ii.84 Clayton Gay Q		Florian: Les collections des oeuvres de Florian se présentent le plus souvent sous la forme de volumes qui ont une page de titre indiquant seulement l’ouvrage en question, mais munis d’un faux titre annonçant le recueil auquel le volume se rattache: Œuvres de M. de Florian, Œuvres de Florian, etc. Ces volumes semblent avoir été vendus aussi à part, et les collections que l’on trouve se composent fréquemment d’éléments publiés à des dates très différentes. Vu ces difficultés, nous avons trouvé nécessaire de rendre compte dans nos listes uniquement de rééditions des volumes séparés, sous leurs différents titres, afin d’éviter la confusion. Certains recueils semblent se dessiner, cependant, avec une netteté relative.					Saillard Tchemerzine 3e personne			cadre pastoral (rives du Tage)			Galatée, Elicio, Erastre			intrigue sentimentale			prose poétique				
83.31			LÉONARD, Nicolas-Germain				Lettres de deux amans habitans de Lyon, publiées par M. Léonard		Londres& Paris			Desenne			1783	1783				3t. in-12			238, 194, 209p.		A BM BN+ AL 1783 VII 73-106; CorrL mai 1783; JL xxi 1783; JP 31.V.83 Delcro Gay Kerby Mornet Q		Gay donne le titre: Histoire tragique des amours de Thérèse et de Faldoni, arrivée à Lyon en 1771, s.l.n.d. Cet ouvrage, ainsi que le roman de Léonard, aurait été fondé, paraît-il, sur l’histoire authentique de deux amants lyonnais. Cf. aussi 76.49.					Lettres			Lyon			Thérèse, Constance, Faldoni			intrigue sentimentale, malheurs			sensibilité larmoyante				
83.40			MIRABEAU, Honoré-Gabriel de Riqueti, comte de				Ma conversion, par M.D.R.C.D.M.F., avec figures en taille-douce, première édition		Londres						1783	1783				in-12			viii + 248p.		BMt BN Apollinaire, Mirabeau B Gay		B et Q donnent le titre: Ma conversion ou le libertin de qualité; Michaud propose: Le Rubicon ou ma conversion (titre que nous n’avons pas retrouvé); Apollinaire donne: Le libertin de qualité ou ma conversion, et selon Gay c’est sous cette forme du titre que l’ouvrage a toujours paru au XVIIIe siècle. L’attribution à Mirabeau a été contestée. Pourtant Apollinaire a signalé dans la correspondance de Mirabeau trois passages où il parle en des termes très clairs du roman de Ma conversion qu’il est en train d’écrire (v. les lettres à Sophie de Monnier du 21 fév. 1780, 5 mars 1780, 26 mars 1780). Selon Apollinaire, plusieurs éditions du XIXe siècle ont porté de fausses dates: 1774(1830), 1783(1866), 1783 (1888), 1801 (1830). Pour un deuxième ouvrage intitulé Ma conversion, qui n’a rien à voir avec le roman de Mirabeau, v. 83.8.					Ire personne			France			la Saint-Just, Julie, Mlle Macao, Agnès			aventures d’un libertin			précisions pornographiques				
83.42			MONTESQUIEU, Charles-Louis de				Secondât, baron de la Brède et de Arsace et Isménie, histoire orientale		Londres & Paris			imprimerie de Didot aîné, G. de Bure			1783	1783				in-18			143p.		BMt AL 1784 III 212; CorrL janv. 1784; JL xxi 1784; JP l.iv.84 Dufrenoy Gay Q		Vian L’ouvrage, écrit en 1742, a été publié par les soins du fils de l’auteur. BUR 1784 déc., pp. 38-76, offre un résumé.					3e personne			Asie			Aspar, Arsace, Ardasire			intrigues politiques et amoureuses			ton sensible				
83.9							Mémoires de Suzon, soeur du portier des Chartreux, suivis de l’Histoire de Marguerite, fille de Suzon								1783	1783									Dawes catalogue, Gay		Les Mémoires de Suzon avaient paru en 1778 (v.78.4). Nous donnons notre description de l’Histoire de Marguerite d’après l’édition de 1784. Gay cite trois éditions qui portent des dates avant 1800 mais qui sont en réalité des éditions du dix-neuvième siècle: 1780(1870), 1784(1830), 1799 (vers 1830).								Paris											Pp. 3-60, Histoire de Marguerite: Ire personne (mais ce n’est pas l’héroïne qui parle); Paris; Marguerite, Dubois, Milord; aventures libertines; précisions pornographiques; 61-96, Dialogue entre Marguerite et le successeur de Dubois		
84.27			GORJY, Jean-Claude				Nouveau voyage sentimental		Londres & Paris			Bastien			1784	1784				in-8			ü + 188p.		BMt BNt AL 1784 VI 120-128; JL xv, xxvi 1784; JP 6.viü.84 Barton							1re personne			province			La Fleur, Thomas, Justine, Zeinevill			voyages, aventures fantaisistes et décousues							
84.43			MÉRARD DE SAINT-JUST, Anne-Jeanne-Félicité d’Ormoy, madame				Bergeries et opuscules de Mlle d’Ornoy l’aînée		En Arcadie et se trouve à Paris			chez Lamy			1784	1784				in-12			iv + 172p.		BMf BNt Monglond Q																					Le volume comporte des dialogues avec quelques récits en prose: Pp. 8-19, L’amant volage sans être inconstant; 20-51, L’indifférence punie et pardonnée, pastorale; 52-66, L’enchantement ou le buste, récit historique, 1772; 67-75, La première leçon d’amour, eglogue; 79-87, L’orage, conte pastoral.		
84.50			NERCIAT, André-Robert Andréa de				L’étourdi		Lampsaque,						1784	1784				2 part, in-12			155, 111 + 3p.		A BM BNt Apollinaire, Nerciat Drujon Gay		Apollinaire attribue cet ouvrage à Neufville-Montador; P. Lacroix (Bull, du bibliophile, 1853, p. 153) au marquis de Sade.					Ire personne (mémoires découpés en lettres)			France			le chevalier de Nanlo, Euphrosine de Therfort, la comtesse de Larba, le chevalier de Serfet, sœur Ursule			aventures libertines							
84.58			RÉTIF DE LA BRETONNE, Nicolas-Edme				La paysanne pervertie ou les dangers de la ville, histoire d’Ursule R**, sœur d’Edmond, le paysan, mise-au-jour d’après les véritables lettres des personages, avec 114 estampes, par l’auteur du Paysan perverti		La Haie & Paris			veuve Duchesne			1784	1784				4t. in-12			344, 220 (pour 320), 320, 336p.		A BM BNt AL 1785 VII 217-237; JL xxxüi 1785; JP 8.X.85 Drujon Gay Q Rives Childs		C’est une suite du Paysan perverti (76.44). Les deux ouvrages ont été réunis dans une édition datée de 1784 mais publiée en 1787 (v. 87.66).					Lettres			province (Auxerre), Paris			Ursule, Mme Parangon, Fauchon, Gaudet, Edmond, le Marquis, Lagouache...			aventures galantes, malheurs d’une villageoise entraînée par le mauvais exemple			sensibilité, intentions moralisatrices, tendances réalistes				
85.24			CHARRIÉRE, Isabelle-Agnès-Elisabeth van Tuyll van Serooskerken van Zuylen, dame de				Lettres écrites de Lausanne		Toulouse						1785	1785				in-8			116p.		BM BNt JL xxxiü 1786; JP 9.ix, 31.XÜ.86, 27.i.88 Godet		Une suite de cet ouvrage a été pubüée en 1787, sous le titre de Ca/iste (v. 87.30) NBR Ire année XIII (1799), pp. 169-220, et 2e année I (1799), pp. 89-142 offre des abrégés des Lettres et de Caliste respectivement.					Lettres			Lausanne			Cécile, le jeune lord, M. Tissot			une mère raconte dans des lettres l’éducation mondaine et sentimentale de sa fille			critique sociale, analyse psychologique				
86.27			CONSTANT DE REBECQUE, Samuel de				Laure ou lettres de quelques femmes de Suisse		Genève, Barde, Manget et compagnie & Paris			Buisson			1786	1786				7t. in-12			xxiv + 226, 248, 266, 258, 264, 234, 295p.		At JL xxiv, xlviii 1786; JP 26.xii. JP26.xii.86 Delcro		A partir du t.II le titre devient:. . . lettres de quelques personnes de Suisse. Tous les exemplaires du t.VII que nous avons vus portent la date de 1787. Les périodiques de 1786 cités ci-dessus ne mentionnent que les t.I-IV.					Lettres			Suisse			Laure de Germosan, Mlle de Mirsor, M. de Verseuil, M. de St. Marain, M. de Marville			intrigue mondaine, histoire d’amour			sensibilité, vie à la campagne				
86.32			DOPPET, François-Amédée				Mémoires de madame de Warens, suivis de ceux de Claude Anet, publiés par un C.D.M.D.P., pour servir d’Apologie aux Confessions de J.J. Rousseau		Chambéry						1786	1786				in-8			iv + xx + 4 + 258p.		BNf CorrL juillet 1786; JL xxviii 1786; JP 22.vii, 12.xi.86 Gay		Delcro et Michaud donnent une édition de 1785, tandis que Q en donne deux: Chambéri, 1785 et Genève et Paris, Leroy, 1785. Nous n’avons pas vu d’exemplaire portant cette date.					1re personne (mémoires)			Suisse, Savoie, Paris			Babet, M. de T***, M. de Warens, le roi Victor-Amédée de Sardaigne			aventures sentimentales, intrigues politiques			pseudo-autobiographie				
86.51			MIRABEAU, Honoré-Gabriel de Riqueti, comte de				Le rideau levé ou l’éducation de Laure		A Cythère						1786	1786				2t. in-12			vi + 98, 122p.		Apollinaire, Mirabeau B Gay Q		B ajoute entre parenthèses: Alençon, Jean-Zacharie Malassis. Apollinaire indique deux éditions du XIXe siècle qui portent de fausses dates: 1790 [vers 1830] et 1788 [vers 1830 également]. Ouvrage attribué également au marquis de Sentilly.					1re personne			Paris			Laurette, Lucette, Justine, Vemol, Courbelon			aventures libertines							
87.25			BECKFORD, William				Vathek		Lausanne			Isaac Hignou et Compe			1787	1787				in-8			iv + 204p.		BMt Dufrenoy Parreaux		Pour l’histoire de la publication de ce roman, v. André Parreaux, William Beckford, auteur de Vathek .... Paris, Nizct, 1960.					3e personne			Samarah			le calife Vathek. la princesse Carathis, Morakanabad, Dilara			voyages, aventures merveilleuses			fin moralisatrice				
87.54bis			LOAISEL DE TRÉOGATE, Joseph-Marie				Ainsi finissent les grandes passions ou les dernières amours du chevalier de.....publiées par M. Loaisel de Tréogate		Paris			Poinçot			1787	1787				2 part, in-12			240, 247p.		Lièget AL 1788 II 217-228		Nous devons la description de cette première édition à M. Townsend W. Bowling, auteur d’une dissertation doctorale: The Life and Works of Loaisel de Tréogate, 1752-1812: A Biographical and Bibliographical Study (Yale), où l’on trouvera de plus amples renseignements. La date de 1781 indiquée par Gay serait une erreur pour 1787.					Lettres			Paris, province			madame de V... (Eugénié), le chevalier de .... le comte de P***, M. de B...			intrigue sentimentale			sensibilité passionnée, retour à la nature				
87.56			LOUVET DE COUVRAY, Jean-Baptiste				Une année de la vie du chevalier de Faublas		Londres & Paris			chez l’auteur, rue Quincampoix, au bureau de la Bonneterie, et chez les marchands de nouveautés			1787	1787				5 part, in-12			viii + 156, 143, 171, 157, 196p.		BNt CorrL avril 1787; JL xlix 1786; JP 18.xii.86, 26.ii.87 Delcro Gay		Le t. V porte par eneur la date de 1786. Deux suites de cet ouvrage ont été publiées: Six semaines de la vie du chevalier de Faublas (88. 83); et La fin des amours du chevalier de Faublas (90.47). Les rééditions où les trois parties sont réunies se retrouveront ci-dessous (Autres éditions).					1re personne, avec récits intercalés 1re personne			Paris			le chevalier de Faublas, Adélaïde, Mlle de Pontis, M. du Portail, la Marquise, Rosembert			aventures galantes			ton léger				
88.53			FLORIAN, Jean-Pierre				Claris de Estelle, roman pastoral par M. de Florian, capitaine de dragons et gentilhomme de S.A.S. Mgr le duc de Penthièvre, des Académies de Madrid, de Florence, de Lyon, de Nîmes, d’Angers, etc., etc.		Paris			de l’imprimerie de Monsieur, chez Debure aîné, Bailly			1788	1788				in-18			209p.		A BNt AL 1788 III 232-259; JL li 1787; JP 23.xii.87, 7.i.88, 29.iii.88 Clayton Delcro Q		Saillard Saint-Fargeau Gay donne la date de 1783, sans doute par erreur pour 1788. BUR 1788 juillet, pp. 51 -121, en donne un résumé.					3e personne			cadre pastoral (Cévennes)			Estelle, Némorin, Hélion, Rose			intrigue sentimentale			style poétique				
88.75			LA PLACE, Pierre-Antoine de				Collection de romans et contes, imités de l’anglois, corrigés et revus de nouveau, par M. de La Place		Paris			Cussac			1788	1788				8t. in-8			xv+ 479, 567, 560, 491,444, 428, 488, 385p.		BNt JL xxvii 1788; JP 12.viii.88 Cobb Delcro Gay Rochedieu Streeter		La collection comprend (t.VIII) des contes qui paraissent en volume pour la première fois. Ces contes, adaptés pour la plupart de modèles anglais, ont été insérés dans le Mercure entre 1760 et 1768 (v. Cobb, pp. 81-82, 143). Un certain nombre des contes avaient déjà paru dans les Lettres à myladi *** (73.25). Le ‘roman dramatique’ Don Fernand (IV, 375-491) est en fait une pièce de théâtre. Les t.I-VII contiennent des traductions et d’autres ouvrages qui avaient déjà paru et dont nous donnons la liste à la fin de cet article.																			VIII, 1-4, Anecdote singulière concernant Henri IV; 5-19, Les deux cousines & tes quatre cousins, historiette bourgeoise; 20-30, Nancy ou l’heureuse infortune, nouvelle angloise; 31-50, I! ne faut jurer de rien, nouvelle angloise et espagnole. 51-60, Abdalla et Balsora, tradition tirée d’un ancien manuscrit persan; 61-70, Grâces au Mercure de France, historiette; 71-95, L’inconnue, nouvelle angloise; 96-100, L’orgueilleux corrigé, conte moral; 101-105, L’amour et la jalousie, conte à la grecque; 106-130, La folle angloise: lettres du capitaine Fortesene à lady Clifford, contenant les aventures d’une jeune Angloise dans l’Amérique septentrionale; 131-138, Sidney ou l’heureux hasard, anecdote angloise; 139-186, Fanny Arthur et Monrose, histoire tragi-galante; 187-213, L’hermite ou l’homme de la montagne; 214-222, Ibraham et Gémille, anecdote turque, historique et tragique; 223-232, Il est des loix dangereuses, anecdote historique, tirée (dit-on) d’un ancien manuscrit grec; 233-244, Il ne faut désespérer de rien, anecdote historique suédoise; 245-253, Erippe, conte gaulois; 254-267. Supplément à la bibliothèque bleue ou histoire du chevalier Jadis, seigneur d’autrefois; 268-292, La probité récompensée, historiette chinoise; 293-304, Les souhaits punis, conte moral, oriental et mythologique; 305-312, Ségilde, anecdote françoise, historique et galante; 313-320, La vestale, anecdote romaine; 1321-381, Brabantio		
89.104			SÉGUR, Alexandre-Joseph-Pierre, vicomte de				Correspondance secrette entre Ninon de Lenclos, le marquis de Villarceaux et madame de M.......		Paris			Le Jay			1789	1789				2 part, in-8			ii + 112, 96p.		BM BNt CorrL oct. 1789 Colombey Monglond Q							Lettres			Paris, province (XVIle siècle)			Mlle de Lenclos, le marquis de Villarceaux, mademoiselle d’Aubigné (madame Sca... [Scarron])			correspondance amoureuse au cours de laquelle le marquis délaisse Ninon pour madame Scarron							
89.81			LESUIRE, Robert-Martin				Le crime ou lettres originales, contenant les aventures de César de Perlencour, par l’auteur de L'Aventurier françois & du Philosophe parvenu		Bruxelles, Dujardin & Paris			Defer de Maisonneuve			1789	1789				4t. in-12			lv + 260, 240, 240, 232p.		A BM BNt JL xiii 1789; JP l.v.89 B Delcro Monglond Q		Une suite de cet ouvrage a été publiée la même année avec le titre: Le repentir (89.82).					Lettres, avec récits intercalés 1re personne			province (Lyon), Paris			M. de Perlencour, le comte de Lysange, César de Perlencour, Dumoulin, le chevalier Marqué, Levrette			aventures d’un jeune provincial entraîné au crime			prétentions moralisatrices				
90.47			LOUVET DE COUVRAY, Jean-Baptiste				La fin des amours du chevalier de Faublas, par M. Louvet de Couvray		Londres & Paris			Bailly			1790	1790				6t. in-12			viii + 151, 178, 155 177, 175, 192p.		BMf BNt Delcro Gay Monglond Q		C’est la suite et fin d'Une année de la vie du chevalier de Faublas ( 87. 56) et de Six semaines de la vie du chevalier de Faublas (88. 83). Pour d’autres détails, v. 87. 56.					1re personne			Paris			Faublas, la marquise de B***, Mme de Montdésir, Mme de Lignolle, Mme de Fonrose, Rosambert....			aventures galantes			ton satirique				
91.42			SADE, Donatien-Alphonse-François, marquis de				Justine ou les malheurs de la vertu		En Hollande			chez les libraires associés			1791	1791				2t in-8			283, 191p.		BNt FC 91 XV 1968 Apollinaire, Sade Gay Lely Monglond Q Valençay		V. aussi la nouvelle version de ce roman publiée en 1797 (97.71).					3e personne, avec récit intercalé 1re personne			Paris, province			la comtesse de Lorsange (Juliette), Justine, madame Duvergier, Dubourg...			les malheurs et aventures de deux soeurs orphelines de caractères opposés			détails pornographiques				
91.43			SAINT-PIERRE, Jacques-Henri				Bernardin de La chaumière indienne, par Jacques-Bemardin-Henri de Saint-Pierre					De l’imprimerie de Monsieur, Paris, P. Fr. Didot le jeune			1791	1791				in-18			xlvii + 130p.		BM BNt JP 2.i.91 ; MF 19.ii.91 Dufrenoy Gumuchian Monglond Q		Q donne une première édition de 1790, mais nous n’avons pu retrouver d’exemplaire portant cette date.					3e personne			Angleterre, Indes			le docteur anglais, le grand-prétre de Jagrenat, le paria			un savant anglais cherche la vérité aux Indes...			conte philosophique				
91.44			VESQUE DE PUTTELANGE, Jean				Le roi Guiot, histoire nouvelle tirée d’un vieux manuscrit poudreux et vermoulu								1791	1791				in-18			vi + 144p.		BMt BNt B Gay Monglond Q							3e personne			au royaume des Pacans			Guiot, Madame, Dézilia			éducation et vie d’un roi			ton satirique				
93.16			NERCIAT, André-Robert Andréa de				Les Aphrodites ou fragmens thali-priapiques pour servir à l’histoire du plaisir, N° 1		Lampsaque						1793	1793				8 part. pet. in-8			80, 80. 80, 79, 88, 75, 90, 82 + iiip.		Stockholmt Apollinaire^Vercrar B Gay Monglond Q		Q donne aussi: 4t. in-12. Apollinaire cite deux éditions de 1864 (BM, BN). L’Enfer de la BN possède aussi une édition s.l.n.d., 4t. in-18, avec une réédition datant de 1925 (BNt).					Dialogues			Paris			madame Durut, la Duchesse, le Chevalier, Trottignac, Célestine....			tableaux du libertinage			précisions pornographiques				
94.13			SOUZA, Adélai’de-Marie-Émilie Filleul, comtesse de Flahaut, puis marquise de				Adèle de Sénange ou lettres de lord Sydenham		Londres						1794	1794				in-8					B Gay Monglond Q							Saint-Fargeau Lettres			Paris, Neuilly			lord Sydenham, Adèle, madame de Yerneuil, M. de Sénange			intrigue sentimentale			analyse des sentiments				
94.8			MAISTRE, comte Xavier de				Voyage autour de ma chambre par M. le chev. X***.O.A.S.D.S.M.S		Turin						1794	1794				in-12			188p.		BNt JP 19 germ., 4 prair. IV Monglond Q																Récit fantaisiste: les objets que l’auteur voit dans sa chambre évoquent des souvenirs, inspirent des réflexions							
95.20			GENLIS, Stéphanie-Félicité Ducrest de Saint-Aubin, marquise de Sillery, comtesse de				Les chevaliers du cygne ou la cour de Charlemagne, conte historique et moral, pour servir de suite aux Veillées du château et dont tous les traits qui peuvent faire allusion à la révolution française, sont tirés de l’histoire, par madame de Genlis, auteur du Théâtre d’éducation, d’Adèle et Théodore, etc.		Paris, Lemierre & Hambourg			P.F. Fauche			1795	1795				3t. in-8			xxiv + 381, 406, 434p.		BNt JP 21 frim., 7 pluv. IV Monglond Q Saint-Fargeau							3e personne			France, Constantinople (époque de Charlemagne)			Isambard, Olivier, Célanire, Vitikind, Ogier le Danois			aventures chevaleresques			sensibilité				
