95.36			SADE, Donatien-Alphonse-François, marquis de				Aline et Valcour ou le roman philosophique, écrit à la Bastille un an avant la Révolution de France, orné de quatorze gravures, par le citoyen S***		Paris			Girouard			1795	1793  Bien que portant la date de 1793, cet ouvrage ne fut publie qu'en 1795.				8t. en 4 v. in-18			xiv + 315, 503, 575, 374p.		JP 9 frim. IV Apollinaire, Sade B Gay Lely Valençay Q		Bien que portant la date de 1793, cet ouvrage ne fut publié qu’en 1795. ’ll en existe théoriquement trois éditions, mais qui proviennent du même tirage, commencé en 1791, interrompu en 1794 par le meurtre légal de Girouard /l’éditeur, qui a été guillotiné/, repris et achevé en 1795. Ces trois éditions... ne diffèrent entre elles que par le contenu des pages de titre... et par le nombre des eaux fortes qui, de quatorze dans les éditions A et B, passent à seize dans l’édition C’ (Lely, p.491 ). Deux contrefaçons de l’épisode de Sainville et de Léonore.95.36 dénoncées par Sade lui-même (Lely, p. 492), ont paru en 1799 (v. ci-dessous, Autres éditions).					Lettres, avec récits intercalés 1re personne			Paris, province, royaume de Butua			Déterville, Valcour; Eugénie, Aline			aventures romanesques, voyages, libertinage			horreur et cruauté				
95.37			SADE, Donatien-Alphonse-François, marquis de				La philosophie dans le boudoir, ouvrage posthume de l’auteur de Justine		Londres			aux dépens de la Compagnie			1795	1795				2t. in-18			180, 214p.		BMt BNt Apollinaire, Sade Gay Lely Monglond Valençay		Q donne: vers 1793. La date est donnée sur la page de titre sous la forme suivante: M.DCC.XCXV.					Dialogues			dans le boudoir d’une libertine			madame de Saint-Ange, le chevalier de Mirvel, Eugénie, Dohnancé			cours de libertinage			précisions pornographiques				
96.18			CHARRIÉRE, Isabelle-Agnès-Elisabeth van Tuyll van Serooskerken van Zuylen, dame de				Les trois femmes, nouvelle, par l’auteur des Lettres de Lausanne, publiée pour le soulagement d’une de ses amies dans le malheur		Londres			de l'imprimerie de Baylis, et se trouve chez J. Deboff, Dulau & Co, & chez tous les marchands de nouveautes			1796	1796				2t. in-18			156, 137p.		BNt		Ouvrage publié pour la première fois dans une version allemande: Drei Weiber..,, Leipzig, 1795 (Godet). V. aussi J.-D. Candaux, ‘Note sur deux éditions mutilées de madame de Charrière’, Revue des sciences humaines, xxxv, no. 137, janv.-mars 1970, 87-92.					3e personne, avec récits intercalés 1re personne et lettres			Allemagne			Emilie (fille d’émigrés), Joséphine, Constance de Vaucourt, Henri, le baron d’Altendorf, Théobald			intrigues mondaines et sentimentales, tableaux des moeurs							
97.21			DIDEROT, Denis				Jacques le fataliste et son maître, par Diderot		Paris			Buisson			1797	an cinquième de la République				2t. in-8			xxii + 286, 320p.		BM BNt JP 8 vend. V Gay Q		Saint-Fargeau Tchemerzine Selon Tchemerzine, certains exemplaires portent: Jacques la fataliste... Cet ouvrage a paru à la fin de 1796, date que donnent les bibliographes. Nous le classons ici en raison de la date révolutionnaire que porte la page de titre.					3e personne, avec dialogues, récits intercalés 1re personne, intervention du narrateur						Jacques, son maître, personnages rencontrés sur le chemin			voyage, aventures bouffonnes, galantes, romanesques			thèmes philosophiques, mise en cause des techniques du romancier				
97.22			DIDEROT, Denis				La religieuse, par Diderot		Paris			Buisson			1797	an cinquième de la République				in-8			411p.		BM BNt JG 1 91; JP 22 vend. V Gay Q		Saint-Fargeau Tchemerzine Gay donne ‘Dufart’ comme éditeur. Cet ouvrage a paru à la fin de 1796, date que donnent les bibliographes. Nous le classons ici en raison de la date révolutionnaire. Une version remaniée et raccourcie de ce roman a été publiée dans un recueil qui a pour titre: Amours, galanteries, intrigues, ruses et crimes des Capucins ..., Amsterdam & Paris, 1788 (BMt, BNt). Mais la date de 1788 est fausse, et il s’agit d’une compilation du XIXe siècle.					1re personne (mémoires)			Paris, province			Marie-Suzanne Simonin, madame de Moni, la sœur Sainte-Christine, la sœur Ursule, M. Manouri			les malheurs de la victime d’une claustration forcée			thèmes philosophiques et humanitaires				
97.74			SÉNAC DE MEILHAN, Gabriel				L’émigré, publié par M. de Meilhan, ci-devant intendant du pays d’Aunis, de Provence, Avignon et du Hainaut, et intendant-général de la guerre et des armées du roi de France, etc. etc.		A Brunsvick			chez P.F. Fauche et compagnie			1797	1797				4t. in-18			x + 251,345, 239, 252p.		BNt Monglond Q							Lettres			Allemagne			la comtesse de Liewenstein, Mlle Emilie de Wergentheim, le marquis de St. Alban			amours malheureuses			éléments d’actualité				
98.38			DIDEROT, Denis				Œuvres de Denis Diderot, publiées sur les manuscrits de l’auteur par Jacques-André Naigeon, de l’Institut national des sciences, etc.		Paris			Desray et Deterville			1798	an VI-1798				15t. in-8					BM BNt JP 30 mess. VIII Q		Certains récits de Diderot paraissent ici pour la première fois: X, 41 5-519, L’oiseau blanc, conte bleu. XII, 377-410, Ceci n’est pas un conte. Pour les autres éditions des Œuvres de Diderot, v.97.21.																					
98.41			FIÉVÉE, Joseph				La dot de Suzette ou histoire de Mme. de Senneterre, racontée par elle-même		Paris			Maradan			1798	an sixième				in-12			xii + 233p.		BMt BNt JG I 143; JP 6 prair. VI, 1 fnict. VII; JT 1 prair., 16 fruct. VI, 8 vend.. 5 pluv. Vil B Gay Monglond Q		NBR lrc année VIII (1798), pp. 106-134, en donne un abrégé.					1re personne			province, Paris			la soeur Sainte-Ursule, M. de Senneterre, Adolphe, Suzette			malheurs, intrigue sentimentale			sensibilité, vertu				
98.84			RÉTIF DE LA BRETONNE, Nicolas-Edme				L’anti-Justine ou les délices de l’amour, par M. Linguet, av. au et en Parlent., avec LX figures		Au Palais-Roial			feue la veuve Girouard			1798	1798				2 part, in-18			204, 252p.		BNt Gay Monglond Rives Childs							1re personne			province			Cupidon, Jenovefette, Cathos, madame Bourgelat,...			de multiples scènes libertines et pornographiques							
98.85			RÉVÉRONI SAINT-CYR, baron Jacques-Antoine de				Pauliska ou la perversité moderne, mémoires récens d’une Polonaise		Paris			Lemierre			1798	an VI,				2t. in-12			iv + 254, 222p.		BNt JP 29 prair. VI; JT 16 prair., 30 fruct. VI, 1 bruni. VII; Veillées I 10 1798 55-67, 11 1798 88-91 Gay Monglond Saint-Fargeau							1re personne (mémoires), avec récit intercalé 1re personne			Pologne, Piémont, Suisse			le chevalier de Morsall, madame de Visbourg, Ernest Pradislas, M. d’Olnitz			les malheurs d’une réfugiée, éléments d’actualité							
98.88			ROSNY, Antoine-Joseph-Nicolas de				Firmin ou le jouet de la fortune, histoire d’un jeune émigré, par Joseph Rosny		Paris			De l’imprimerie de Glisau, Pigoreau			1798	an VI de la République				2 part, in-18			174, 187p.		BNt JT 24 therm. VI Monglond Q							1re personne, avec récits intercalés 1re personne			France, Pays-Bas			Thomassin (laboureur), Marianne, Georges, le comte de Stainville, Sophie, Coralie			aventures révolutionnaires, voyages							
99.104			LA GRAVE, comtesse de				Sophie de Beauregard ou le véritable amour, par L.C.L.G.		Paris			De l’imprimerie de Legras et Cordier, chez Le Prieur			1799	an VII				2t. in-12			216, 211p.		BNt JP 4 pluv. VII; JT 8 vend. VII Gay Monglond Q		Gay donne aussi une édition pour l’an VI que nous n’avons pu retrouver.					Lettres			Paris, province			Sophie de Beauregard, Emilie d’Armincourt, M. Darcy, le comte de Belleville			intrigue mondaine, histoire sentimentale							
99.105			LA GRAVE, comtesse de				Zabeth ou la victime de l’ambition, par l’auteur de Sophie de Beauregard		Paris			Le Prieur			1799	an septième				2t. in-12			263, 224p.		BNt JP 2 prair. Vil; JT 5 pluv. VII; MF 10 germ. VII Monglond		Q donne une édition pour l’an VI que nous n’avons pu retrouver.					3e personne			province, Angleterre			M. de Saint-Silvain, Zabeth, mademoiselle de P’ermon, Enneric			querelles de famille, intrigue sentimentale							
99.43			ARNAUD, François-Thomas-Marie de Baculard d’				Les matinées, nouvelles anecdotes par Darnaud (sic)		Paris			de l’imprimerie de Vatar-Jouannet			1799	an VII				3t. in-12			286, 170, 177p.		BNt JG II 122; JT 20 mess. VII Inklaar Monglond Pigoreau Q		Q donne: Lemière et Maradan, 1799, 3t. in-12. /, Géminville et Dolimon ou l’héroïsme de l’amour et de l’amitié. II, Miss Elisabeth Lindley ou la femme héros. III, Virginie ou l’orpheline reconnaissante.																					
99.62			COTTIN, Sophie Ristaud, dame				Claire d’Albe, par la C. ***		Paris			Maradan			1799	an VII				in-12			viii + 285p.		BMt JG II 139; JP 14 prair. VII; JT 25 flor. VII; Veillées III 3 an VIII 258-263 Monglond Q Saint-Fargeau Sykes							Lettres			province (Tours)			Claire d’Albe, Elise de Biré, Adolphe, Frédéric			intrigue sentimentale (une femme vertueuse éprouvée par l’amour)			analyse des sentiments, sensibilité, vertu				
99.76			DUCRAY-DUMINIL, François-Guillaume				Les cinquante francs de Jeannette, par le citoyen Ducray-Duminil		Paris			Le Prieur			1799	an VII				2t. in-12			xiii + 1 5-251,251p.		BM BNt JP 3e jour compl. VII; JT 15 germ. VII Monglond Q Saint-Fargeau							3e personne			Paris, province			M. d’Erainville, Rosalie, Jeannette, Briceval			malheurs d’une enfant trouvée qui est adoptée par une dame charitable			nature, sensibilité, vertu, bienfaisance				